{
  "contract_version": "semantic-reasoning-v1",
  "result_id": "SRR-TM3-015-STRICT-BLIND-v2.1",
  "input_package_id": "SRP-TM3-015-DCFC-v2.1",
  "input_package_hash": "d86e2e9a5b52dae16382ed68d3d495fd27aafe9478f1e63fc1c100325312af3e",
  "initial_reasoning": {
    "pass_id": "INITIAL-STRICT-BLIND-1",
    "findings": [
      {
        "finding_id": "F-CONNECTION-SEQUENCE",
        "candidate_refs": [],
        "observation_refs": ["O-248FA28FD648", "O-CCCAD844E3A0", "O-30A5630397C5", "O-DECE03E5A445", "O-4D428E122092", "O-F1EC04428859"],
        "relation_refs": [],
        "event_refs": ["EA-248FA28FD648", "EA-CCCAD844E3A0", "EA-30A5630397C5", "EA-DECE03E5A445", "EA-4D428E122092", "EA-F1EC04428859"],
        "fact_bindings": [
          {"claim_class": "OBSERVED", "support_refs": ["O-248FA28FD648", "O-CCCAD844E3A0", "O-30A5630397C5", "O-DECE03E5A445"], "statement": "Several decoded charge-port fields changed at CAN-observed times 20.7178–21.0173 s."},
          {"claim_class": "OBSERVED", "support_refs": ["O-4D428E122092", "O-F1EC04428859"], "statement": "Two additional decoded connection/charger-state fields first changed at 39.7192 s and 40.1183 s."},
          {"claim_class": "INFERRED", "support_refs": ["O-248FA28FD648", "O-30A5630397C5", "O-DECE03E5A445", "O-4D428E122092"], "statement": "The grouped sequence is compatible with vehicle-side detection of a physical connection followed by a visible charger-type state, but field semantics are not independently confirmed."},
          {"claim_class": "UNSUPPORTED", "support_refs": [], "statement": "The frozen evidence does not identify the actual human insertion, scan, authorization, or lock-completion time."}
        ],
        "l3_domain_mapping": {"system": "直流快充系统", "mainline_ref": "CML-DCFC-START", "role": "vehicle-visible connection and charger-state sequence"},
        "control_tree_mapping": {"node_ref": "CT-DCFC-01", "mapping_status": "PARTIAL", "reason": "Multiple vehicle-side port fields move coherently, but external action time and independent semantic validation are absent."},
        "evidence_requirement_mapping": [
          {"evidence_requirement_ref": "ER-01", "status": "PARTIAL_SUPPORT", "basis_refs": ["O-248FA28FD648", "O-CCCAD844E3A0", "O-30A5630397C5", "O-DECE03E5A445"], "reason": "CAN state projection is present; required external event time is missing."},
          {"evidence_requirement_ref": "ER-02", "status": "PARTIAL_SUPPORT", "basis_refs": ["O-4D428E122092", "O-F1EC04428859"], "reason": "More than one visible state changes, but this cannot establish a complete protocol handshake."}
        ],
        "relationship_kind": "STATE_SEQUENCE",
        "causality_status": "TEMPORAL_ASSOCIATION_ONLY",
        "semantic_hypothesis": "A vehicle-visible connection-state sequence exists before the later high-voltage/output sequence.",
        "alternative_explanations": [
          {"alternative_id": "ALT-CONN-DBC", "description": "One or more decoded names/enumerations may not match this vehicle or DLC variant.", "compatible_observation_refs": ["O-248FA28FD648", "O-30A5630397C5", "O-4D428E122092"], "discriminating_evidence": "Independent physical port/lock observations synchronized to CAN plus definition validation.", "minimum_check": "Repeat one connect/disconnect cycle with externally recorded event times and port-state evidence."},
          {"alternative_id": "ALT-CONN-INTERNAL", "description": "The changes may be internal state transitions after an earlier unobserved human action.", "compatible_observation_refs": ["O-CCCAD844E3A0", "O-F1EC04428859"], "discriminating_evidence": "Observed human action timestamps.", "minimum_check": "Record door-open, insertion, lock, and removal as separate external events."}
        ],
        "model_interaction": "SUPPORTS_CURRENT_MODEL",
        "supported_claims": ["A multi-field vehicle-visible connection sequence is observed."],
        "unsupported_claims": ["Complete charging protocol negotiation is confirmed.", "CAN times equal human-event times."],
        "missing_evidence": [
          {"gap_id": "G-CONN-TIME", "blocked_claim": "Distinguish door opening, insertion, and locking as physical events.", "missing_evidence_type": "EXTERNAL_EVENT_TIME", "reason": "Only CAN-observed transition times are available.", "minimum_evidence_needed": "Synchronized external event log or video for each physical action.", "priority": "P0"},
          {"gap_id": "G-CONN-SEM", "blocked_claim": "Confirm each decoded connection field's physical meaning.", "missing_evidence_type": "SIGNAL_VALIDATION", "reason": "DBC labels are not independent semantic evidence.", "minimum_evidence_needed": "Repeat physical action with independent state observation and consistent transition direction.", "priority": "P1"}
        ],
        "signal_validation_needed": true,
        "minimum_next_check": "Repeat a single connect/disconnect cycle with synchronized external timestamps for door, insertion, lock and removal; verify all six field transitions without treating CAN time as action time.",
        "uncertainty": "Medium: grouping and order are observed, while physical labels and event causality remain unvalidated.",
        "confidence": "MEDIUM",
        "trace_refs": ["O-248FA28FD648", "O-CCCAD844E3A0", "O-30A5630397C5", "O-DECE03E5A445", "O-4D428E122092", "O-F1EC04428859", "EA-248FA28FD648", "EA-4D428E122092"]
      },
      {
        "finding_id": "F-HV-OUTPUT-ESTABLISHMENT",
        "candidate_refs": [],
        "observation_refs": ["O-2644736F4A49", "O-7D22A98C2406", "O-8EBD6B851F2B", "O-FF177FEE2DC2", "O-7980F7D7EA4B", "O-BFA7B49A9AC9", "O-CA4507EB8924"],
        "relation_refs": [],
        "event_refs": ["EA-2644736F4A49", "EA-7D22A98C2406", "EA-8EBD6B851F2B", "EA-FF177FEE2DC2", "EA-7980F7D7EA4B", "EA-BFA7B49A9AC9"],
        "fact_bindings": [
          {"claim_class": "OBSERVED", "support_refs": ["O-2644736F4A49", "O-7D22A98C2406", "O-8EBD6B851F2B", "O-FF177FEE2DC2"], "statement": "Decoded contactor/high-voltage fields changed during 133.3907–139.4878 s CAN time."},
          {"claim_class": "OBSERVED", "support_refs": ["O-7980F7D7EA4B", "O-BFA7B49A9AC9"], "statement": "Decoded EVSE-side voltage first changed at 140.0275 s and current first changed at 145.0277 s."},
          {"claim_class": "INFERRED", "support_refs": ["O-2644736F4A49", "O-FF177FEE2DC2", "O-7980F7D7EA4B", "O-BFA7B49A9AC9", "O-CA4507EB8924"], "statement": "The ordered changes are compatible with high-voltage/output establishment and Pack current response, but do not expose the permission decision or prove causality."}
        ],
        "l3_domain_mapping": {"system": "直流快充系统", "mainline_ref": "CML-DCFC-START", "role": "high-voltage and actual-output establishment"},
        "control_tree_mapping": {"node_ref": "CT-DCFC-05", "mapping_status": "PARTIAL", "reason": "High-voltage and output-state observations align temporally, while direct permission is absent."},
        "evidence_requirement_mapping": [
          {"evidence_requirement_ref": "ER-03", "status": "PARTIAL_SUPPORT", "basis_refs": ["O-2644736F4A49", "O-7D22A98C2406", "O-8EBD6B851F2B", "O-FF177FEE2DC2", "O-BFA7B49A9AC9"], "reason": "State and current establishment are compatible, but no direct condition/permission observation exists."},
          {"evidence_requirement_ref": "ER-04", "status": "INSUFFICIENT", "basis_refs": ["O-7980F7D7EA4B", "O-BFA7B49A9AC9", "O-CA4507EB8924"], "reason": "Actual-side candidates exist, but validated vehicle request voltage/current observations do not."}
        ],
        "relationship_kind": "STATE_SEQUENCE",
        "causality_status": "CAUSALITY_NOT_ESTABLISHED",
        "semantic_hypothesis": "A visible HV-state transition precedes decoded output voltage/current establishment in this capture.",
        "alternative_explanations": [
          {"alternative_id": "ALT-HV-DECODE", "description": "Partial DBC coverage or enum mismatch could distort the apparent contactor/HV sequence.", "compatible_observation_refs": ["O-2644736F4A49", "O-7D22A98C2406", "O-8EBD6B851F2B", "O-FF177FEE2DC2"], "discriminating_evidence": "Independent HV/contactor state evidence and repeated ordering.", "minimum_check": "Repeat start sequence and compare vehicle HV indication or independent voltage measurement with these transitions."},
          {"alternative_id": "ALT-HV-COMMON-CAUSE", "description": "A hidden controller or protocol state may drive both HV and output transitions.", "compatible_observation_refs": ["O-FF177FEE2DC2", "O-7980F7D7EA4B", "O-BFA7B49A9AC9"], "discriminating_evidence": "Direct permission/request observations.", "minimum_check": "Acquire a validated vehicle permission or request signal in a future experiment."}
        ],
        "model_interaction": "SUPPORTS_CURRENT_MODEL",
        "supported_claims": ["HV-related state changes precede decoded output-current establishment in CAN time."],
        "unsupported_claims": ["Vehicle charging permission was observed.", "EVSE internal decision or protocol stage was observed."],
        "missing_evidence": [
          {"gap_id": "G-HV-PERM", "blocked_claim": "Map the vehicle-side condition/permission decision.", "missing_evidence_type": "CONDITION_OR_PERMISSION", "reason": "No validated direct permission observation is supplied.", "minimum_evidence_needed": "A separately validated permission/enable state synchronized with HV and current establishment.", "priority": "P0"},
          {"gap_id": "G-HV-REQUEST", "blocked_claim": "Establish request-to-actual control relationship.", "missing_evidence_type": "DIRECT_REQUEST", "reason": "Capability and Actual cannot substitute for Request.", "minimum_evidence_needed": "Validated vehicle requested voltage and current observations.", "priority": "P0"}
        ],
        "signal_validation_needed": true,
        "minimum_next_check": "In a repeated start, record an independent HV/output indication and obtain separately validated vehicle request or permission evidence.",